{
  "version": "CloudRF API 3.36",
  "reference": "https://cloudrf.com/documentation/developer/",
  "template": {
    "name": "DM1400-403MHz-25W-12.5kHz",
    "service": "https://api.cloudrf.com",
    "created_at": "2026-10-11T16:23:35+00:00",
    "owner": "CloudRF",
    "bom_value": 1
  },
  "site": "DM1400",
  "network": "Motorola Solutions",
  "engine": 1,
  "coordinates": 1,
  "transmitter": {
    "lat": 41.8803,
    "lon": -87.64,
    "alt": 1.5,
    "frq": 403,
    "txw": 25,
    "bwi": 0.0125,
    "powerUnit": "W"
  },
  "receiver": {
    "lat": 0,
    "lon": 0,
    "alt": 1.5,
    "rxg": 2,
    "rxs": -109
  },
  "feeder": {
    "flt": 0,
    "fll": 0,
    "fcc": 0
  },
  "antenna": {
    "mode": "custom",
    "txg": 2,
    "txl": 0,
    "ant": 0,
    "azi": 0,
    "tlt": 0,
    "hbw": 360,
    "vbw": 120,
    "fbr": 0,
    "pol": "v"
  },
  "model": {
    "pm": 4,
    "pe": 2,
    "ked": 2,
    "rel": 80
  },
  "environment": {
    "elevation": 2,
    "landcover": 1,
    "buildings": 1,
    "obstacles": 0,
    "clt": "Temperate.clt"
  },
  "output": {
    "units": "m",
    "col": "RAINBOW.dBm",
    "out": 2,
    "nf": -123,
    "res": 10,
    "rad": 10
  }
}