{
  "version": "CloudRF-API-v3.31",
  "reference": "https://cloudrf.com/documentation/developer/",
  "template": {
    "name": " MPU5-BASBand-5MHz",
    "service": "https://dev.cloudrf.com",
    "created_at": "2025-01-28T12:00:00+00:11",
    "owner": "",
    "bom_value": ""
  },
  "site": "PSBASBand-5MHz",
  "network": "PS",
  "engine": 2,
  "coordinates": 1,
  "transmitter": {
    "lat": 38,
    "lon": 1,
    "alt": 2,
    "frq": 2025,
    "txw": 6,
    "bwi": 5,
    "powerUnit": "W"
  },
  "receiver": {
    "lat": 38,
    "lon": 1,
    "alt": 1,
    "rxg": 2,
    "rxs": 12
  },
  "feeder": {
    "flt": "1",
    "fll": 0,
    "fcc": 0
  },
  "antenna": {
    "mode": "template",
    "txg": 2,
    "txl": 0,
    "ant": 39,
    "azi": 0,
    "tlt": 0,
    "hbw": 0,
    "vbw": 0,
    "fbr": 0,
    "pol": "v"
  },
  "model": {
    "pm": 4,
    "pe": 2,
    "ked": 2,
    "rel": 90
  },
  "environment": {
    "elevation": 2,
    "landcover": 1,
    "buildings": 1,
    "obstacles": 0,
    "clt": "Minimal.clt"
  },
  "output": {
    "units": "m",
    "col": "SNR.dB",
    "out": 4,
    "ber": 1,
    "mod": 1,
    "nf": -107,
    "res": 10,
    "rad": 10
  }
}