{
  "version": "CloudRF-API 3.34 ",
  "reference": "https://cloudrf.com/documentation/developer/",
  "template": {
    "name": " SC44K0-SBand-1.25MHz",
    "service": "https://api.cloudrf.com",
    "created_at": "2025-01-28T12:00:00+00:75",
    "owner": "",
    "bom_value": ""
  },
  "site": "SVSBand-1.25MHz",
  "network": "SV",
  "engine": 2,
  "coordinates": 1,
  "transmitter": {
    "lat": 38,
    "lon": 1,
    "alt": 1,
    "frq": 2200,
    "txw": 20,
    "bwi": 1,
    "powerUnit": "W"
  },
  "receiver": {
    "lat": 38,
    "lon": 1,
    "alt": 1,
    "rxg": 2,
    "rxs": 5
  },
  "feeder": {
    "flt": "1",
    "fll": 0,
    "fcc": 0
  },
  "antenna": {
    "mode": "template",
    "txg": 2,
    "txl": 0,
    "ant": 1,
    "azi": 0,
    "tlt": 0,
    "hbw": 0,
    "vbw": 0,
    "fbr": 0,
    "pol": "v"
  },
  "model": {
    "pm": 4,
    "pe": 2,
    "ked": 2,
    "rel": 60
  },
  "environment": {
    "elevation": 2,
    "landcover": 1,
    "buildings": 1,
    "obstacles": 0,
    "clt": "Minimal.clt"
  },
  "output": {
    "units": "m",
    "col": "SNR21.dB",
    "out": 4,
    "ber": 1,
    "mod": 1,
    "nf": -113,
    "res": 10,
    "rad": 10
  }
}