{
  "version": "CloudRF-API 3.34 ",
  "reference": "https://cloudrf.com/documentation/developer/",
  "template": {
    "name": "UBNT-NBE-5AC",
    "service": "https://api.cloudrf.com",
    "created_at": "2025-01-28T12:00:00+00:86",
    "owner": "",
    "bom_value": ""
  },
  "site": "AP",
  "network": "WIFI",
  "engine": 2,
  "coordinates": 1,
  "transmitter": {
    "lat": 50,
    "lon": 0,
    "alt": 8,
    "frq": 5850,
    "txw": 0,
    "bwi": 20,
    "powerUnit": "W"
  },
  "receiver": {
    "lat": 50,
    "lon": 0,
    "alt": 2,
    "rxg": 2,
    "rxs": -90
  },
  "feeder": {
    "flt": "1",
    "fll": 0,
    "fcc": 0
  },
  "antenna": {
    "mode": "custom",
    "txg": 19,
    "txl": 0,
    "ant": 0,
    "azi": 90,
    "tlt": 0,
    "hbw": 0,
    "vbw": 0,
    "fbr": 0,
    "pol": "v"
  },
  "model": {
    "pm": 4,
    "pe": 2,
    "ked": 2,
    "rel": 60
  },
  "environment": {
    "elevation": 2,
    "landcover": 1,
    "buildings": 1,
    "obstacles": 0,
    "clt": "Minimal.clt"
  },
  "output": {
    "units": "m",
    "col": "RAINBOW.dBm",
    "out": 2,
    "ber": 1,
    "mod": 1,
    "nf": -101,
    "res": 10,
    "rad": 10
  }
}